cleaning service huntsville al;https://thevalleycleanteam.com/locations/huntsville
house cleaning huntsville alabama;https://thevalleycleanteam.com/locations/huntsville
maid service huntsville al;https://thevalleycleanteam.com/locations/huntsville
cleaning service athens al;https://thevalleycleanteam.com/locations/athens
house cleaning athens alabama;https://thevalleycleanteam.com/locations/athens
maid service athens al;https://thevalleycleanteam.com/locations/athens
cleaning service florence al;https://thevalleycleanteam.com/locations/florence
house cleaning florence alabama;https://thevalleycleanteam.com/locations/florence
maid service shoals area;https://thevalleycleanteam.com/locations/florence
cleaning service decatur al;https://thevalleycleanteam.com/locations/decatur
house cleaning decatur alabama;https://thevalleycleanteam.com/locations/decatur
maid service decatur al;https://thevalleycleanteam.com/locations/decatur
cleaning service mountain brook al;https://thevalleycleanteam.com/locations/mountain-brook
house cleaning mountain brook alabama;https://thevalleycleanteam.com/locations/mountain-brook
luxury home cleaning mountain brook;https://thevalleycleanteam.com/locations/mountain-brook
cleaning service birmingham al;https://thevalleycleanteam.com/locations/birmingham
house cleaning birmingham alabama;https://thevalleycleanteam.com/locations/birmingham
maid service birmingham al;https://thevalleycleanteam.com/locations/birmingham
cleaning service nashville tn;https://thevalleycleanteam.com/locations/nashville
house cleaning nashville tennessee;https://thevalleycleanteam.com/locations/nashville
maid service nashville tn;https://thevalleycleanteam.com/locations/nashville
house cleaning hampton cove al;https://thevalleycleanteam.com/locations/huntsville/hampton-cove
cleaning service hampton cove;https://thevalleycleanteam.com/locations/huntsville/hampton-cove
maid service hampton cove alabama;https://thevalleycleanteam.com/locations/huntsville/hampton-cove
house cleaning jones valley huntsville;https://thevalleycleanteam.com/locations/huntsville/jones-valley
cleaning service jones valley al;https://thevalleycleanteam.com/locations/huntsville/jones-valley
house cleaning madison al;https://thevalleycleanteam.com/locations/madison
cleaning service madison alabama;https://thevalleycleanteam.com/locations/madison
maid service madison al;https://thevalleycleanteam.com/locations/madison
house cleaning harvest al;https://thevalleycleanteam.com/locations/huntsville/harvest
cleaning service harvest alabama;https://thevalleycleanteam.com/locations/huntsville/harvest
house cleaning meridianville al;https://thevalleycleanteam.com/locations/huntsville/meridianville
cleaning service meridianville alabama;https://thevalleycleanteam.com/locations/huntsville/meridianville
house cleaning owens cross roads al;https://thevalleycleanteam.com/locations/huntsville/owens-cross-roads
cleaning service owens cross roads;https://thevalleycleanteam.com/locations/huntsville/owens-cross-roads
house cleaning big cove al;https://thevalleycleanteam.com/locations/huntsville/big-cove
cleaning service big cove huntsville;https://thevalleycleanteam.com/locations/huntsville/big-cove
house cleaning monte sano huntsville;https://thevalleycleanteam.com/locations/huntsville/monte-sano
cleaning service monte sano al;https://thevalleycleanteam.com/locations/huntsville/monte-sano
house cleaning twickenham huntsville;https://thevalleycleanteam.com/locations/huntsville/twickenham
cleaning service twickenham al;https://thevalleycleanteam.com/locations/huntsville/twickenham
house cleaning blossomwood huntsville;https://thevalleycleanteam.com/locations/huntsville/blossomwood
cleaning service blossomwood al;https://thevalleycleanteam.com/locations/huntsville/blossomwood
house cleaning the ledges huntsville;https://thevalleycleanteam.com/locations/huntsville/the-ledges
cleaning service the ledges al;https://thevalleycleanteam.com/locations/huntsville/the-ledges
office cleaning research park huntsville;https://thevalleycleanteam.com/locations/huntsville/research-park
commercial cleaning research park;https://thevalleycleanteam.com/locations/huntsville/research-park
house cleaning belle meade nashville;https://thevalleycleanteam.com/locations/nashville/belle-meade
cleaning service belle meade tn;https://thevalleycleanteam.com/locations/nashville/belle-meade
maid service belle meade;https://thevalleycleanteam.com/locations/nashville/belle-meade
house cleaning green hills nashville;https://thevalleycleanteam.com/locations/nashville/green-hills
cleaning service green hills tn;https://thevalleycleanteam.com/locations/nashville/green-hills
maid service green hills;https://thevalleycleanteam.com/locations/nashville/green-hills
house cleaning brentwood tn;https://thevalleycleanteam.com/locations/nashville/brentwood
cleaning service brentwood tennessee;https://thevalleycleanteam.com/locations/nashville/brentwood
maid service brentwood tn;https://thevalleycleanteam.com/locations/nashville/brentwood
house cleaning franklin tn;https://thevalleycleanteam.com/locations/nashville/franklin
cleaning service franklin tennessee;https://thevalleycleanteam.com/locations/nashville/franklin
maid service franklin tn;https://thevalleycleanteam.com/locations/nashville/franklin
house cleaning forest hills nashville;https://thevalleycleanteam.com/locations/nashville/forest-hills
cleaning service forest hills tn;https://thevalleycleanteam.com/locations/nashville/forest-hills
house cleaning oak hill nashville;https://thevalleycleanteam.com/locations/nashville/oak-hill
cleaning service oak hill tn;https://thevalleycleanteam.com/locations/nashville/oak-hill
house cleaning 12 south nashville;https://thevalleycleanteam.com/locations/nashville/12-south
cleaning service 12 south;https://thevalleycleanteam.com/locations/nashville/12-south
house cleaning hillsboro village nashville;https://thevalleycleanteam.com/locations/nashville/hillsboro-village
cleaning service hillsboro village;https://thevalleycleanteam.com/locations/nashville/hillsboro-village
house cleaning sylvan park nashville;https://thevalleycleanteam.com/locations/nashville/sylvan-park
cleaning service sylvan park;https://thevalleycleanteam.com/locations/nashville/sylvan-park
house cleaning the nations nashville;https://thevalleycleanteam.com/locations/nashville/the-nations
cleaning service the nations tn;https://thevalleycleanteam.com/locations/nashville/the-nations
house cleaning bellevue nashville;https://thevalleycleanteam.com/locations/nashville/bellevue
cleaning service bellevue tn;https://thevalleycleanteam.com/locations/nashville/bellevue
house cleaning west meade nashville;https://thevalleycleanteam.com/locations/nashville/west-meade
cleaning service west meade;https://thevalleycleanteam.com/locations/nashville/west-meade
house cleaning crieve hall nashville;https://thevalleycleanteam.com/locations/nashville/crieve-hall
cleaning service crieve hall;https://thevalleycleanteam.com/locations/nashville/crieve-hall
house cleaning woodbine nashville;https://thevalleycleanteam.com/locations/nashville/woodbine
cleaning service woodbine;https://thevalleycleanteam.com/locations/nashville/woodbine
house cleaning homewood al;https://thevalleycleanteam.com/locations/birmingham/homewood
cleaning service homewood alabama;https://thevalleycleanteam.com/locations/birmingham/homewood
maid service homewood al;https://thevalleycleanteam.com/locations/birmingham/homewood
house cleaning vestavia hills al;https://thevalleycleanteam.com/locations/birmingham/vestavia-hills
cleaning service vestavia hills alabama;https://thevalleycleanteam.com/locations/birmingham/vestavia-hills
maid service vestavia hills;https://thevalleycleanteam.com/locations/birmingham/vestavia-hills
house cleaning hoover al;https://thevalleycleanteam.com/locations/birmingham/hoover
cleaning service hoover alabama;https://thevalleycleanteam.com/locations/birmingham/hoover
maid service hoover al;https://thevalleycleanteam.com/locations/birmingham/hoover
house cleaning cahaba heights al;https://thevalleycleanteam.com/locations/birmingham/cahaba-heights
cleaning service cahaba heights;https://thevalleycleanteam.com/locations/birmingham/cahaba-heights
house cleaning liberty park birmingham;https://thevalleycleanteam.com/locations/birmingham/liberty-park
cleaning service liberty park al;https://thevalleycleanteam.com/locations/birmingham/liberty-park
house cleaning cherokee bend mountain brook;https://thevalleycleanteam.com/locations/mountain-brook/cherokee-bend
cleaning service cherokee bend;https://thevalleycleanteam.com/locations/mountain-brook/cherokee-bend
house cleaning english village mountain brook;https://thevalleycleanteam.com/locations/mountain-brook/english-village
cleaning service english village;https://thevalleycleanteam.com/locations/mountain-brook/english-village
house cleaning mountain brook village;https://thevalleycleanteam.com/locations/mountain-brook/village
cleaning service mountain brook village;https://thevalleycleanteam.com/locations/mountain-brook/village
estate cleaning mountain brook;https://thevalleycleanteam.com/locations/mountain-brook/luxury-cleaning
luxury home cleaning birmingham;https://thevalleycleanteam.com/locations/mountain-brook/luxury-cleaning
house cleaning historic district florence;https://thevalleycleanteam.com/locations/florence/historic-district
cleaning service historic florence;https://thevalleycleanteam.com/locations/florence/historic-district
house cleaning rivermont florence;https://thevalleycleanteam.com/locations/florence/rivermont
cleaning service rivermont al;https://thevalleycleanteam.com/locations/florence/rivermont
house cleaning wilson lake florence;https://thevalleycleanteam.com/locations/florence/wilson-lake
cleaning service wilson lake;https://thevalleycleanteam.com/locations/florence/wilson-lake
house cleaning lakeside estates florence;https://thevalleycleanteam.com/locations/florence/lakeside-estates
cleaning service lakeside estates;https://thevalleycleanteam.com/locations/florence/lakeside-estates
house cleaning shoals creek florence;https://thevalleycleanteam.com/locations/florence/shoals-creek
cleaning service shoals creek;https://thevalleycleanteam.com/locations/florence/shoals-creek
house cleaning elkmont al;https://thevalleycleanteam.com/locations/athens/elkmont
cleaning service elkmont alabama;https://thevalleycleanteam.com/locations/athens/elkmont
maid service elkmont;https://thevalleycleanteam.com/locations/athens/elkmont
house cleaning tanner al;https://thevalleycleanteam.com/locations/athens/tanner
cleaning service tanner alabama;https://thevalleycleanteam.com/locations/athens/tanner
maid service tanner;https://thevalleycleanteam.com/locations/athens/tanner
house cleaning ardmore al;https://thevalleycleanteam.com/locations/athens/ardmore
maid service ardmore alabama;https://thevalleycleanteam.com/locations/athens/ardmore
cleaning service ardmore al tn;https://thevalleycleanteam.com/locations/athens/ardmore
house cleaning east limestone al;https://thevalleycleanteam.com/locations/athens/east-limestone
cleaning service east limestone;https://thevalleycleanteam.com/locations/athens/east-limestone
house cleaning clements al;https://thevalleycleanteam.com/locations/athens/clements
cleaning service clements alabama;https://thevalleycleanteam.com/locations/athens/clements
house cleaning lindsay lane athens;https://thevalleycleanteam.com/locations/athens/lindsay-lane
cleaning service lindsay lane;https://thevalleycleanteam.com/locations/athens/lindsay-lane
house cleaning belle mina al;https://thevalleycleanteam.com/locations/athens/belle-mina
maid service belle mina alabama;https://thevalleycleanteam.com/locations/athens/belle-mina
house cleaning priceville al;https://thevalleycleanteam.com/locations/decatur/priceville
cleaning service priceville alabama;https://thevalleycleanteam.com/locations/decatur/priceville
maid service priceville;https://thevalleycleanteam.com/locations/decatur/priceville
house cleaning hartselle al;https://thevalleycleanteam.com/locations/decatur/hartselle
maid service hartselle alabama;https://thevalleycleanteam.com/locations/decatur/hartselle
cleaning service hartselle;https://thevalleycleanteam.com/locations/decatur/hartselle
house cleaning trinity al;https://thevalleycleanteam.com/locations/decatur/trinity
cleaning service trinity alabama;https://thevalleycleanteam.com/locations/decatur/trinity
house cleaning point mallard decatur;https://thevalleycleanteam.com/locations/decatur/point-mallard
cleaning service point mallard;https://thevalleycleanteam.com/locations/decatur/point-mallard
house cleaning danville al;https://thevalleycleanteam.com/locations/decatur/danville
maid service danville alabama;https://thevalleycleanteam.com/locations/decatur/danville
house cleaning somerville al;https://thevalleycleanteam.com/locations/decatur/somerville
cleaning service somerville alabama;https://thevalleycleanteam.com/locations/decatur/somerville
house cleaning austinville decatur;https://thevalleycleanteam.com/locations/decatur/austinville
cleaning service austinville;https://thevalleycleanteam.com/locations/decatur/austinville
