postAtSpecificTime,text,link,imageUrls,videoUrls,mediaOptimized,instagramPostType,short,story,video,reel,followUpComment,youtubeTitle,tiktokDuetStitch,pinterestTitle,pinterestLink,googleBusinessProfileType,communityPostTitle,communityNotifyMembers
2026/04/07 09:00:00,"One year ago, we had nothing.

Todd broke his leg so badly he was airlifted. Five months without walking. I was surprise-laid off from my corporate job. We had a 10-month-old baby. We'd just moved to family land two weeks before the accident — boxes still unpacked.

We started The Valley Clean Team with less than $5,000.

No bank loans. No investors. No safety net. Just the internet, our brains, and the will to make it work.

Today? We're projecting $250,000 in our first full calendar year. We have 13 incredible providers covering all of North Alabama. And we're just getting started.

If you're sitting on an idea and waiting for the ""right time"" — this is your sign. There's no perfect time. Build the airplane while you fly it. ✈️

Thank you to everyone who has supported us this year — our clients, our providers, our family, and our community. We couldn't have done this without you. 🙏

#ValleyCleanTeam #SmallBusiness #NorthAlabama #Entrepreneurship",https://thevalleycleanteam.com,https://assets.cdn.filesafe.space/iKQIBhpKVL2XVPgU7HMd/media/69cd2edb2a8b881968e08b1f.png,,true,,,,,,,,,,,,
2026/04/08 11:00:00,"Last Veterans Day, we gave away a free cleaning to honor a veteran in our community.

The response was incredible. Real stories from real families about heroes who served our country.

My father was a Vietnam veteran. When those men and women came home, they weren't welcomed — they were spit on.

So whenever I see someone wearing a Vietnam veteran hat in Walmart, I don't say ""thank you for your service."" I say:

""Welcome home.""

It's something many of them never heard. And it means more than you know.

We're proud to serve those who served us. 🇺🇸

#Veterans #GivingBack #Community #ValleyCleanTeam",https://thevalleycleanteam.com,,,,,,,,,,,,,,,,
2026/04/09 09:00:00,"Here's something most cleaning companies won't tell you:

Industry standard pay for house cleaners? $10/hour.

Our model? 50/50 split. Our providers consistently earn more than we do after expenses.

Why? Because cleaning is HARD. Go mop 5,000 square feet of hardwood floor and tell me it's not.

These are skilled professionals with attention to detail, time management, and heart. The fact that society doesn't value them the way they should doesn't mean WE won't.

When you book with The Valley Clean Team, you're supporting a company that puts its providers first. Every time. 💚

#ValleyCleanTeam #FairPay #SmallBusiness #NorthAlabama",https://thevalleycleanteam.com,https://assets.cdn.filesafe.space/iKQIBhpKVL2XVPgU7HMd/media/69cd2eda281591e6fce32485.png,,true,,,,,,,,,,,,
2026/04/10 12:00:00,"Things that matter to us that you might not even think about:

✅ We don't schedule residential cleans after a certain time — we respect your evening
✅ We never clean in the dark — you can't clean what you can't see
✅ We track arrival times so you're never left wondering ""where are they?""
✅ We're not the cable guy — when we say 9 AM, we mean 9 AM
✅ Every clean follows a consistent checklist from start to finish

Your home is your space. We treat it like ours. 🏡

Book your clean today → thevalleycleanteam.com

#ValleyCleanTeam #HouseCleaning #NorthAlabama #TrustWorthy",https://thevalleycleanteam.com,,,,,,,,,,,,,,,,
2026/04/11 09:00:00,"Money can't buy you happiness.

But it CAN buy you time.

Time to go to the soccer game. Time to cook dinner without stress. Time to sit on the couch and breathe.

When a dad calls us and says ""Please help my wife — we both work full-time, we have four kids, and we just can't get the laundry done""…

That's not a cleaning job. That's giving a family their time back. ⏰

You don't have to do it all. And you don't have to feel bad about asking for help.

💚 The Valley Clean Team — Giving you back what matters most.

#ValleyCleanTeam #BuyTime #WorkingParents #NorthAlabama",https://thevalleycleanteam.com,https://assets.cdn.filesafe.space/iKQIBhpKVL2XVPgU7HMd/media/69cd2eda87c93bca5b728d98.png,,true,,,,,,,,,,,,
2026/04/14 09:00:00,"""Deep clean"" means something different to every person.

That's exactly why we built a detailed checklist into our booking process.

From the initial sale → to the walk-through → to every room in your home → to the final check-off.

Consistency is what built our business. Consistency is what will grow it.

When you book with us, you know exactly what you're getting. No surprises. No guesswork. Just a clean home, every single time. ✅

Book now → thevalleycleanteam.com

#ValleyCleanTeam #DeepClean #Consistency #NorthAlabama",https://thevalleycleanteam.com,,,,,,,,,,,,,,,,
2026/04/15 10:00:00,"Hey mama. This one's for you. 🫶

I know you think you should be able to do it all. Keep the house spotless. Work full-time. Get the kids to practice. Make dinner. Be everything for everyone.

I'm a mom too. And I learned the hard way: you can do a lot of things, but you can't do ALL the things.

It's okay to ask for help. It's okay to come home to a clean house that someone else cleaned. It's okay to choose the soccer game over the mop.

You're not failing. You're prioritizing.

And that's exactly what makes you a great mom. 💚

— Christen, co-owner of The Valley Clean Team

#ValleyCleanTeam #MomLife #WorkingMom #ItsOkay #NorthAlabama",https://thevalleycleanteam.com,,,,,,,,,,,,,,,,
2026/04/16 11:00:00,"People ask us: ""How do you find good cleaners?""

The truth? Sometimes we BUILD them. 🔨

We've developed an on-the-job training program where I (Christen) personally work alongside new providers. Side by side. Room by room.

Not everyone comes to us with professional cleaning experience. But if they have the right heart, we can teach the skills.

Because you can teach someone to clean a bathroom. You can't teach someone to care. ❤️

Interested in joining our team? Visit thevalleycleanteam.com

#ValleyCleanTeam #NowHiring #TeamBuilding #NorthAlabama",https://thevalleycleanteam.com,https://assets.cdn.filesafe.space/iKQIBhpKVL2XVPgU7HMd/media/69cd2eda899e533a9b5e7807.png,,true,,,,,,,,,,,,
2026/04/17 14:00:00,"Fun fact about The Valley Clean Team:

Todd is an Alabama fan. 🐘
Christen is an Auburn fan. 🐅

They call it a ""mixed marriage"" in Alabama. 😂

But somehow they've managed to build a business together, raise a daughter, and only argue about football… most of the time.

Happy Friday, North Alabama! Who are you rooting for this weekend? 🏈

#ValleyCleanTeam #FunFactFriday #Alabama #Auburn #MixedMarriage #NorthAlabama",https://thevalleycleanteam.com,,,,,,,,,,,,,,,,
2026/04/21 09:00:00,"ONE YEAR of The Valley Clean Team. 🎉

To our very first customer — thank you for taking a chance on us. (Yes, you're getting a free month of cleaning. You earned it.)

To our providers — thank you for trusting us when we were brand new and unproven. You ARE this company.

To our families — thank you for the garbage cans hauled to the road, the snacks delivered, the babysitting, and the endless support.

To our community — thank you for choosing local. Thank you for your reviews, your referrals, and your kind words.

We started with nothing but a broken leg, a baby, and a dream. And you helped us build something real.

Here's to year two. We're just getting started. 🚀

#ValleyCleanTeam #OneYear #Anniversary #ThankYou #NorthAlabama",https://thevalleycleanteam.com,,,,,,,,,,,,,,,,
2026/04/07 12:00:00,"How We Built a $250K Business With Less Than $5,000

🏥 August 2022: Todd breaks his leg. Airlifted. Can't walk for 5 months.
👶 October 2022: Christen is surprise-laid off. 10-month-old at home. Zero income.
💡 The Pivot: ""All I had was time, a remote, and a brain."" Found Cody Sanchez on YouTube. Researched boring businesses.
🚀 What $5K bought us: LLC registration, BookingKoala, Canva branding, domain, phone system.
📈 Year One Results: $250K revenue, 13 providers, all of North Alabama covered.

There is no perfect time to start. Build the airplane while you fly it. ✈️

One year ago we had a broken leg, a baby, and zero dollars. Today we're a $250K cleaning business. This is the real story — no sugarcoating, no guru advice, just two people who were forced to figure it out. The best time to start was yesterday. The second best time is now. 💚

#SmallBusiness #Entrepreneurship #CleaningBusiness #StartupStory #NorthAlabama #BuildTheAirplane #ValleyCleanTeam",https://thevalleycleanteam.com,https://assets.cdn.filesafe.space/iKQIBhpKVL2XVPgU7HMd/media/69cd2edb2a8b881968e08b1f.png,,true,Post,,,,,,,,,,,,
2026/04/09 12:00:00,"Perfectionism is the enemy of progress. When we started our business, we couldn't afford a graphic designer, a copywriter, or a fancy website. So I opened Canva and made things myself. I wrote every word of copy on our website.

Was it perfect? No.
Did it work? Absolutely.

Stop waiting for everything to be ""ready."" Ship it. Learn. Improve. Repeat.

""Good enough is better than nothing. We'll fix it later.""

#DoneIsBetterThanPerfect #SmallBusinessTips #Entrepreneurship #StartBeforeYoureReady #ValleyCleanTeam",https://thevalleycleanteam.com,https://assets.cdn.filesafe.space/iKQIBhpKVL2XVPgU7HMd/media/69cd2edb2a8b882be1e08b17.png,,true,Post,,,,,,,,,,,,
2026/04/11 12:00:00,"A dad called us last week. Four kids. Both parents working full-time. He said: ""Please help my wife. We just can't get it all done.""

We didn't just clean their house. We gave them their evening back. Their weekend back. Their peace of mind back.

This is why we do what we do. Not for the revenue. For the stories like this one.

💚 The Valley Clean Team — Because you deserve to come home and breathe.

DM us or visit the link in bio to book your first clean. You don't have to do it all. We promise.

#CleanHome #BusyFamily #WorkingParents #NorthAlabama #ValleyCleanTeam #HouseCleaningService",https://thevalleycleanteam.com,https://assets.cdn.filesafe.space/iKQIBhpKVL2XVPgU7HMd/media/69cd2eda87c93bca5b728d98.png,,true,Post,,,,,,,,,,,,
2026/04/13 10:00:00,"3 Red Flags When Hiring a Cleaning Service 🚩

❌ They give you a quote without asking about your home
❌ They offer a ""1–5 PM arrival window"" (We show up at the time we book. Period.)
❌ They don't have a checklist or guarantee

Not all cleaning companies are created equal. Here's what to look for — and what to run from. 🏃‍♀️

At The Valley Clean Team, we use a detailed checklist on every single job. We show up on time. And we have a guarantee because we know we're going to deliver.

Are we perfect? No. But we're honest about it — and we'll always make it right. 💚

#CleaningTips #HowToChoose #CleaningService #NorthAlabama #ValleyCleanTeam",https://thevalleycleanteam.com,,,,,Post,,,,,,,,,,,,
2026/04/15 14:00:00,"He's Alabama. I'm Auburn. He's the extrovert. I'm the thinker. He talks to strangers in Walmart about cleaning. I strategize behind the scenes in mom groups.

We're both Type A. We're both driven. And yes — we butt heads. A lot. 😂

But that's what makes this partnership work. He sees problems from the front lines. I see them from the bird's-eye view. Together, we cover every angle.

Marriage is hard. Business is hard. Doing both together? Really hard. But also really, really worth it.

This is us. Unfiltered. Still figuring it out. Still grateful. 💚

#CouplesInBusiness #MarriedEntrepreneurs #SmallBusinessLife #RealTalk #ValleyCleanTeam",https://thevalleycleanteam.com,,,,,Post,,,,,,,,,,,,
2026/04/17 09:00:00,"Before we started The Valley Clean Team, we spent 15+ years building businesses for OTHER people. Moving across the country. Missing dinners. Answering work calls at midnight.

When we finally started our own company, we made a promise:

→ Pay people what they're worth
→ Stop at 5 PM
→ Say no to bad clients
→ Put providers before profit
→ Be honest — even when it's hard

It's not perfect. But we can put our heads on the pillow at night knowing we did our best and treated people right.

That's our standard. That's our brand. 💚

""We took everything we hated about the corporate world and said: 'When we do this, we're going to do it differently.'""

#CompanyValues #BusinessEthics #PeopleFirst #CleaningBusiness #ValleyCleanTeam",https://thevalleycleanteam.com,https://assets.cdn.filesafe.space/iKQIBhpKVL2XVPgU7HMd/media/69cd2edaddfdcbd707798f15.png,,true,Post,,,,,,,,,,,,
2026/04/19 10:00:00,"Tired of making $10/hour with no control over your schedule?

Here's what working with The Valley Clean Team looks like:

✅ 50/50 pay split (you earn more than most full-time cleaners)
✅ YOU choose your schedule
✅ YOU choose which jobs to take
✅ We handle marketing, scheduling, billing, and client issues
✅ Real onboarding and training support
✅ A team that actually cares about you

You love to clean. We love to run the boring stuff. Let's be a team. 💪

Apply at the link in bio or DM us to learn more.

Serving all of North Alabama — Shoals, Huntsville, Decatur, and beyond.

#NowHiring #CleaningJobs #NorthAlabama #JoinOurTeam #ValleyCleanTeam #HouseCleanerJobs",https://thevalleycleanteam.com,https://assets.cdn.filesafe.space/iKQIBhpKVL2XVPgU7HMd/media/69cd2eda899e533a9b5e7807.png,,true,Post,,,,,,,,,,,,
2026/04/20 11:00:00,"One of our providers cleaned a home for a man with dementia. His house was so unsanitary that Social Services wouldn't let him come home from the hospital.

Pest control killed the bugs. But they don't clean up after. (Fun fact: most don't.)

So we went in. On our hands and knees. Through the aftermath.

The pay was minimal. But our provider came back and said six words that remind us why we do this:

""My heart is full for helping this man.""

This business was never just about cleaning houses. It's about cleaning up lives. 💚

#ServingOthers #CommunityFirst #PurposeDriven #ValleyCleanTeam #NorthAlabama",https://thevalleycleanteam.com,https://assets.cdn.filesafe.space/iKQIBhpKVL2XVPgU7HMd/media/69cd2eda76082e6ef3d606f3.png,,true,Post,,,,,,,,,,,,
2026/04/21 14:00:00,"My wife says I have ""golden retriever energy."" 🐕

I talk to EVERYONE. The guy at Walmart checkout. The lady in the clearance aisle. The paint aisle stranger whose ceiling vents tell me their restaurant needs a deep clean.

Saturday morning, our carpet cleaner couldn't get in because the key person didn't show. I was at Walmart. The checkout guy asked ""how's your morning?""

Most people say ""fine."" I told him the whole story.

20 minutes later, he's asking about our business and telling me about his staffing problems.

Marketing isn't always ads and funnels. Sometimes it's just being a human who gives a real answer to ""how are you?"" 🤷

#NetworkingTips #GoldenRetrieverEnergy #SmallBusinessMarketing #BeHuman #ValleyCleanTeam",https://thevalleycleanteam.com,,,,,Post,,,,,,,,,,,,
2026/04/22 10:00:00,"Running a cleaning business isn't glamorous. But it IS flexible. And that flexibility means I never miss dinner with my family. That's the real win.

☀️ 8:00 AM — Check the schedule on BookingKoala
📱 8:15 AM — Review overnight messages with our VA
📞 9:00 AM — Tier 2 interviews with potential cleaners
🏠 10:30 AM — Send provider on their way to first clean
📊 12:00 PM — Check KPIs and review reports
🤝 2:00 PM — BNI networking meeting
🏡 5:00 PM — Switch to Dad mode. Business is closed.
👨‍👩‍👧 5:02 PM — If I'm late, I hear about it 😂

#DayInTheLife #SmallBusinessOwner #CleaningBusiness #WorkLifeBalance #ValleyCleanTeam",https://thevalleycleanteam.com,,,,,Post,,,,,,,,,,,,
2026/04/08 08:00:00,"In August 2022, I broke my leg so badly I was airlifted. Five months, zero weight-bearing.

Two weeks earlier, we'd just moved into our new home on raw family land. We still had unpacked boxes. My wife was working corporate marketing. We had a 10-month-old.

Then in October, my wife was ""surprise-retired."" Walked in the door with a severance package and a baby on her hip.

Here's what we had:
→ Zero extra cash
→ Zero bank loans
→ Zero industry experience in cleaning
→ Less than $5,000 total

Here's what we did:
→ Incorporated an LLC
→ Built a website on BookingKoala
→ Used Canva for branding
→ Our first customer came in December 2022

One year later: $250,000 in projected revenue. 13 providers. Covering all of North Alabama.

The lesson? There is no perfect time to start. We were literally forced to start.

And I'd tell anyone sitting on the couch right now with a broken leg, a layoff letter, or a mountain of excuses:

You have the internet. You have your brain. You have time. That's enough.

Build the airplane while you fly it. ✈️

#Entrepreneurship #SmallBusiness #StartupStory #Resilience #CleaningBusiness",https://thevalleycleanteam.com,,,,,,,,,,,,,,,,
2026/04/10 08:00:00,"We turned down a massive corporate account last month.

Not because we couldn't do the work. Because of a contract clause.

They wanted us to sign a general building contractor agreement — making us responsible for things like air filters and porch screens that had nothing to do with our cleaning scope.

The contract was non-negotiable.

So we said no.

Here's what I've learned after running businesses for 15+ years:

→ Every contract is negotiable. If it's not, that's a red flag.
→ If a client is inflexible before you start, they'll be a nightmare within 60 days.
→ Revenue that costs you your integrity isn't revenue — it's a liability.

We don't chase every dollar. We identify the RIGHT clients — partners who respect boundaries, communicate clearly, and value quality.

Sometimes the most profitable word in business is ""No.""

#BusinessBoundaries #ClientManagement #Entrepreneurship #QualityOverQuantity",https://thevalleycleanteam.com,,,,,,,,,,,,,,,,
2026/04/14 08:00:00,"When we started The Valley Clean Team, I expected the hardest part to be finding clients.

It wasn't.

The hardest part was getting our providers to trust us.

They'd come from companies paying $10/hour. No schedule control. No say in which jobs they took. Completely devalued.

So when we told them we do a 50/50 split, that they control their schedule, and that we'd handle all the ""boring stuff"" — marketing, scheduling, client disputes…

They didn't believe us.

We had to earn that trust. Week by week. Paycheck by paycheck.

Now our providers make more than we do after expenses. And we're okay with that. Because without them, there is no Valley Clean Team.

One of our cleaners recently helped a man with dementia whose home was so unsanitary he couldn't be discharged from the hospital. The pay was minimal. But she came back and said:

""My heart is full for helping this man.""

That's what happens when you build a company that values its people.

→ Pay them what they're worth
→ Protect their time and safety
→ Listen to their feedback
→ Let them do what they love

They don't work FOR us. They work WITH us.

#Leadership #PeopleFirst #SmallBusiness #CompanyCulture",https://thevalleycleanteam.com,,,,,,,,,,,,,,,,
2026/04/16 08:00:00,"The social media gurus will tell you to ""grind until you bleed.""

We tried that version of success. It broke us.

Not financially. Physically. Emotionally. Relationally.

Now we live by a different philosophy: 1% better every day.

→ We went from 28 Google reviews to 36 in two weeks
→ We didn't dump $10K into a marketing campaign — we trained our team to ask
→ We don't measure success by month-over-month revenue spikes — we measure lead inputs daily

The ""hustle culture"" influencers won't tell you this, but:

Willpower can be infinite. Time is not.

You can work 18-hour days and still not move the needle if you're working on the wrong things.

Or you can work 8–5, delegate to trusted people, go home, cook fish tacos with your family, and build something sustainable.

We choose sustainable. Every single day.

#HustleCulture #WorkLifeBalance #Leadership #1PercentBetter",https://thevalleycleanteam.com,,,,,,,,,,,,,,,,
2026/04/18 08:00:00,"The best sales strategy I've ever used costs $0.

I just listen.

When someone calls asking ""how much does it cost?"" — I don't answer. Not in the first 10 seconds.

Because there's always a story:
- ""My dad died and we need to clean the house for the wake.""
- ""We have four kids and both work full-time and we just can't get the laundry done.""
- ""I just moved and I need help.""

If you LISTEN, you don't have to ask awkward qualifying questions. The answers are already there.

→ If they mention moving → ""That sounds perfect for our move-in/move-out package.""
→ If they mention a recurring struggle → ""Let's set you up on a regular schedule.""
→ If they sound overwhelmed → ""That's exactly why we exist.""

The best salespeople aren't talkers. They're listeners who know when to offer the right solution at the right moment.

Stop pitching. Start listening.

#SalesTips #CustomerExperience #SmallBusiness #Entrepreneurship",https://thevalleycleanteam.com,,,,,,,,,,,,,,,,
